{
  "schemaVersion": 1,
  "id": "purejsimage",
  "project": "PureJsImage",
  "homepage": "https://github.com/a-r-d/PureJsImage",
  "sourceType": "github-repository",
  "trackingRef": "main",
  "pinnedRevision": "3a1b9936037b308181840a8db65cf4476e70e737",
  "evidence": {
    "sourceUrls": ["https://github.com/a-r-d/PureJsImage"],
    "licenseUrls": [
      "https://github.com/a-r-d/PureJsImage/blob/3a1b9936037b308181840a8db65cf4476e70e737/LICENSE"
    ]
  },
  "defaultRedistribution": "unknown",
  "expectedStability": "repository",
  "updatePolicy": "Resolve explicitly, review license evidence, and accept changed bytes only by command.",
  "notes": ["The source record does not grant rights to every third-party asset it may contain."]
}
