{
  "schemaVersion": 1,
  "id": "libjxl-testdata",
  "project": "libjxl testdata submodule",
  "homepage": "https://github.com/libjxl/testdata",
  "sourceType": "github-tree",
  "trackingRef": "main",
  "pinnedRevision": "73695d303670c90e4d506ea89d9901b081385089",
  "evidence": {
    "sourceUrls": ["https://github.com/libjxl/testdata"],
    "licenseUrls": [
      "https://github.com/libjxl/testdata/tree/73695d303670c90e4d506ea89d9901b081385089"
    ]
  },
  "defaultRedistribution": "unknown",
  "expectedStability": "repository",
  "updatePolicy": "Resolve explicitly, review license evidence, and accept changed bytes only by command.",
  "notes": ["The source record does not grant rights to every third-party asset it may contain."]
}
