{
  "schemaVersion": 1,
  "id": "openmicroscopy-images",
  "project": "Open Microscopy test images",
  "homepage": "https://downloads.openmicroscopy.org/images/",
  "sourceType": "http-index",
  "trackingRef": "website",
  "pinnedRevision": "snapshot-2026-08-28",
  "evidence": {
    "sourceUrls": ["https://downloads.openmicroscopy.org/images/"],
    "licenseUrls": ["https://downloads.openmicroscopy.org/images/"]
  },
  "defaultRedistribution": "unknown",
  "expectedStability": "unstable",
  "updatePolicy": "Resolve explicitly, review license evidence, and accept changed bytes only by command.",
  "notes": ["The source record does not grant rights to every third-party asset it may contain."]
}
