{
  "schemaVersion": 1,
  "id": "surface-topography",
  "project": "SurfaceTopography examples",
  "homepage": "https://github.com/ContactEngineering/SurfaceTopography/tree/master/test/file_format_examples",
  "sourceType": "github-tree",
  "trackingRef": "main",
  "pinnedRevision": "52b45d838418e292ecf4400cd9744573cd84493e",
  "evidence": {
    "sourceUrls": [
      "https://github.com/ContactEngineering/SurfaceTopography/tree/master/test/file_format_examples"
    ],
    "licenseUrls": [
      "https://github.com/ContactEngineering/SurfaceTopography/blob/52b45d838418e292ecf4400cd9744573cd84493e/LICENSE"
    ]
  },
  "defaultRedistribution": "unknown",
  "expectedStability": "repository",
  "updatePolicy": "Resolve explicitly, review license evidence, and accept changed bytes only by command.",
  "notes": ["The source record does not grant rights to every third-party asset it may contain."]
}
