{
  "schemaVersion": 1,
  "id": "rosettasciio",
  "project": "RosettaSciIO test data",
  "homepage": "https://github.com/hyperspy/rosettasciio",
  "sourceType": "github-tree",
  "trackingRef": "main",
  "pinnedRevision": "bc254db14cd7d4d23169b11aeb622a0a7eac1fbe",
  "evidence": {
    "sourceUrls": ["https://github.com/hyperspy/rosettasciio"],
    "licenseUrls": [
      "https://github.com/hyperspy/rosettasciio/blob/bc254db14cd7d4d23169b11aeb622a0a7eac1fbe/LICENSE"
    ]
  },
  "defaultRedistribution": "unknown",
  "expectedStability": "repository",
  "updatePolicy": "Resolve explicitly, review license evidence, and accept changed bytes only by command.",
  "notes": ["The source record does not grant rights to every third-party asset it may contain."]
}
