{
  "schemaVersion": 1,
  "id": "ome-ngff-spec",
  "project": "OME-NGFF specification",
  "homepage": "https://ngff.openmicroscopy.org/latest/",
  "sourceType": "http-index",
  "trackingRef": "latest",
  "pinnedRevision": "0.5",
  "evidence": {
    "sourceUrls": ["https://ngff.openmicroscopy.org/latest/"],
    "licenseUrls": ["https://github.com/ome/ngff"]
  },
  "defaultRedistribution": "unknown",
  "expectedStability": "unstable",
  "updatePolicy": "Resolve explicitly, review license evidence, and accept changed bytes only by command.",
  "notes": ["The source record does not grant rights to every third-party asset it may contain."]
}
