{
  "schemaVersion": 1,
  "id": "libavif",
  "project": "libavif",
  "homepage": "https://github.com/AOMediaCodec/libavif/tree/main/tests/data",
  "sourceType": "github-tree",
  "trackingRef": "main",
  "pinnedRevision": "eb673097950e0b0ec77f696958091ef0244a45a9",
  "evidence": {
    "sourceUrls": ["https://github.com/AOMediaCodec/libavif/tree/main/tests/data"],
    "licenseUrls": [
      "https://github.com/AOMediaCodec/libavif/blob/eb673097950e0b0ec77f696958091ef0244a45a9/LICENSE"
    ]
  },
  "defaultRedistribution": "unknown",
  "expectedStability": "repository",
  "updatePolicy": "Resolve explicitly, review license evidence, and accept changed bytes only by command.",
  "notes": ["The source record does not grant rights to every third-party asset it may contain."]
}
