{
  "schemaVersion": 1,
  "id": "imazen-codec-corpus",
  "project": "Imazen codec-corpus",
  "homepage": "https://github.com/imazen/codec-corpus",
  "sourceType": "github-repository",
  "trackingRef": "main",
  "pinnedRevision": "4fdbdf17909594c1ea96bd879d1785ef507161d0",
  "evidence": {
    "sourceUrls": ["https://github.com/imazen/codec-corpus"],
    "licenseUrls": [
      "https://github.com/imazen/codec-corpus/tree/4fdbdf17909594c1ea96bd879d1785ef507161d0"
    ]
  },
  "defaultRedistribution": "unknown",
  "expectedStability": "repository",
  "updatePolicy": "Resolve explicitly, review license evidence, and accept changed bytes only by command.",
  "notes": ["The source record does not grant rights to every third-party asset it may contain."]
}
