{
  "schemaVersion": 1,
  "id": "libwebp-test-data",
  "project": "libwebp-test-data",
  "homepage": "https://github.com/webmproject/libwebp-test-data",
  "sourceType": "github-repository",
  "trackingRef": "main",
  "pinnedRevision": "06ddd96e276c2c638a72d39d3c0f340afd61978c",
  "evidence": {
    "sourceUrls": ["https://github.com/webmproject/libwebp-test-data"],
    "licenseUrls": [
      "https://github.com/webmproject/libwebp-test-data/tree/06ddd96e276c2c638a72d39d3c0f340afd61978c"
    ]
  },
  "defaultRedistribution": "unknown",
  "expectedStability": "repository",
  "updatePolicy": "Resolve explicitly, review license evidence, and accept changed bytes only by command.",
  "notes": ["The source record does not grant rights to every third-party asset it may contain."]
}
