{
  "schemaVersion": 1,
  "id": "kikuchipy-data",
  "project": "kikuchipy data",
  "homepage": "https://github.com/pyxem/kikuchipy-data",
  "sourceType": "github-repository",
  "trackingRef": "main",
  "pinnedRevision": "bcab8f7a4ffdb86a97f14e2327a4813d3156a85e",
  "evidence": {
    "sourceUrls": ["https://github.com/pyxem/kikuchipy-data"],
    "licenseUrls": [
      "https://github.com/pyxem/kikuchipy-data/tree/bcab8f7a4ffdb86a97f14e2327a4813d3156a85e"
    ]
  },
  "defaultRedistribution": "unknown",
  "expectedStability": "repository",
  "updatePolicy": "Resolve explicitly, review license evidence, and accept changed bytes only by command.",
  "notes": ["The source record does not grant rights to every third-party asset it may contain."]
}
