{
  "schemaVersion": 1,
  "id": "itk-testing-data",
  "project": "ITKTestingData",
  "homepage": "https://github.com/InsightSoftwareConsortium/ITKTestingData",
  "sourceType": "github-repository",
  "trackingRef": "main",
  "pinnedRevision": "90f1ac8644568c7b9857395e77d83211a8b00c14",
  "evidence": {
    "sourceUrls": ["https://github.com/InsightSoftwareConsortium/ITKTestingData"],
    "licenseUrls": [
      "https://github.com/InsightSoftwareConsortium/ITKTestingData/tree/90f1ac8644568c7b9857395e77d83211a8b00c14"
    ]
  },
  "defaultRedistribution": "unknown",
  "expectedStability": "repository",
  "updatePolicy": "Resolve explicitly, review license evidence, and accept changed bytes only by command.",
  "notes": ["The source record does not grant rights to every third-party asset it may contain."]
}
