{
  "schemaVersion": 1,
  "id": "radiance",
  "project": "Radiance",
  "homepage": "https://github.com/LBNL-ETA/Radiance",
  "sourceType": "github-repository",
  "trackingRef": "main",
  "pinnedRevision": "e3749f9e69acf32c7ccca65d4a39ecdff565af39",
  "evidence": {
    "sourceUrls": ["https://github.com/LBNL-ETA/Radiance"],
    "licenseUrls": [
      "https://github.com/LBNL-ETA/Radiance/blob/e3749f9e69acf32c7ccca65d4a39ecdff565af39/License.txt"
    ]
  },
  "defaultRedistribution": "unknown",
  "expectedStability": "repository",
  "updatePolicy": "Resolve explicitly, review license evidence, and accept changed bytes only by command.",
  "notes": ["The source record does not grant rights to every third-party asset it may contain."]
}
